{
  "$schema": "https://json-schema.org/draft/2020-12/schema",
  "$id": "https://project13.local/contracts/reduction-configuration.schema.json",
  "title": "Project 13 reduction configuration",
  "description": "Strict configuration for color, 1X2, point, odds and transparent payout reduction.",
  "type": "object",
  "additionalProperties": false,
  "required": [
    "schema_version",
    "target",
    "row_price",
    "conditions"
  ],
  "properties": {
    "schema_version": {
      "const": "p13-reduction-input-v1"
    },
    "target": {
      "$ref": "#/$defs/target"
    },
    "row_price": {
      "$ref": "#/$defs/numericValue"
    },
    "conditions": {
      "$ref": "#/$defs/conditions"
    }
  },
  "$defs": {
    "numericValue": {
      "oneOf": [
        {
          "type": "number"
        },
        {
          "type": "string",
          "pattern": "^-?(?:0|[1-9][0-9]*)(?:\\.[0-9]+)?$"
        }
      ]
    },
    "outcome": {
      "type": "string",
      "enum": [
        "1",
        "X",
        "2"
      ]
    },
    "marketSnapshotSelection": {
      "type": "string",
      "enum": [
        "earlier",
        "later"
      ]
    },
    "target": {
      "type": "object",
      "additionalProperties": false,
      "required": [
        "game_type"
      ],
      "properties": {
        "coupon_id": {
          "type": [
            "string",
            "null"
          ],
          "minLength": 1
        },
        "game_type": {
          "type": "string",
          "enum": [
            "topptipset",
            "stryktipset",
            "europatipset"
          ]
        },
        "frame_pattern": {
          "type": [
            "string",
            "null"
          ],
          "minLength": 1
        }
      }
    },
    "cell": {
      "type": "object",
      "additionalProperties": false,
      "required": [
        "match",
        "outcome"
      ],
      "properties": {
        "match": {
          "type": "integer",
          "minimum": 1
        },
        "outcome": {
          "$ref": "#/$defs/outcome"
        }
      }
    },
    "colorRule": {
      "type": "object",
      "additionalProperties": false,
      "required": [
        "color",
        "cells",
        "min",
        "max"
      ],
      "properties": {
        "color": {
          "type": "string",
          "enum": [
            "red",
            "yellow",
            "blue",
            "pink",
            "purple",
            "green"
          ]
        },
        "cells": {
          "type": "array",
          "minItems": 1,
          "uniqueItems": true,
          "items": {
            "$ref": "#/$defs/cell"
          }
        },
        "min": {
          "type": "integer",
          "minimum": 0
        },
        "max": {
          "type": "integer",
          "minimum": 0
        }
      }
    },
    "pointAssignment": {
      "type": "object",
      "additionalProperties": false,
      "required": [
        "match",
        "outcome",
        "points"
      ],
      "properties": {
        "match": {
          "type": "integer",
          "minimum": 1
        },
        "outcome": {
          "$ref": "#/$defs/outcome"
        },
        "points": {
          "type": "integer",
          "minimum": 1,
          "maximum": 99
        }
      }
    },
    "pointRule": {
      "type": "object",
      "additionalProperties": false,
      "required": [
        "assignments",
        "min",
        "max"
      ],
      "properties": {
        "assignments": {
          "type": "array",
          "minItems": 1,
          "uniqueItems": true,
          "items": {
            "$ref": "#/$defs/pointAssignment"
          }
        },
        "min": {
          "type": "integer",
          "minimum": 0
        },
        "max": {
          "type": "integer",
          "minimum": 0
        }
      }
    },
    "integerRange": {
      "type": "object",
      "additionalProperties": false,
      "required": [
        "min",
        "max"
      ],
      "properties": {
        "min": {
          "type": "integer",
          "minimum": 0
        },
        "max": {
          "type": "integer",
          "minimum": 0
        }
      }
    },
    "oneXTwoRule": {
      "type": "object",
      "additionalProperties": false,
      "minProperties": 1,
      "properties": {
        "1": {
          "$ref": "#/$defs/integerRange"
        },
        "X": {
          "$ref": "#/$defs/integerRange"
        },
        "2": {
          "$ref": "#/$defs/integerRange"
        }
      }
    },
    "marketRule": {
      "type": "object",
      "additionalProperties": false,
      "required": [
        "market_snapshot",
        "min",
        "max"
      ],
      "properties": {
        "market_snapshot": {
          "$ref": "#/$defs/marketSnapshotSelection"
        },
        "min": {
          "$ref": "#/$defs/numericValue"
        },
        "max": {
          "$ref": "#/$defs/numericValue"
        }
      }
    },
    "payoutRule": {
      "description": "Transparent uppskattad utdelning med versionerad Project 13-modell.",
      "type": "object",
      "additionalProperties": false,
      "required": [
        "market_snapshot",
        "turnover",
        "top_prize_pool",
        "base_unit_stake",
        "min",
        "max"
      ],
      "properties": {
        "market_snapshot": {
          "$ref": "#/$defs/marketSnapshotSelection"
        },
        "turnover": {
          "$ref": "#/$defs/numericValue"
        },
        "top_prize_pool": {
          "$ref": "#/$defs/numericValue"
        },
        "base_unit_stake": {
          "$ref": "#/$defs/numericValue"
        },
        "min": {
          "$ref": "#/$defs/numericValue"
        },
        "max": {
          "$ref": "#/$defs/numericValue"
        }
      }
    },
    "conditions": {
      "type": "object",
      "additionalProperties": false,
      "minProperties": 1,
      "properties": {
        "colors": {
          "type": "array",
          "minItems": 1,
          "maxItems": 6,
          "items": {
            "$ref": "#/$defs/colorRule"
          }
        },
        "one_x_two": {
          "$ref": "#/$defs/oneXTwoRule"
        },
        "points": {
          "$ref": "#/$defs/pointRule"
        },
        "odds": {
          "$ref": "#/$defs/marketRule"
        },
        "payout": {
          "$ref": "#/$defs/payoutRule"
        }
      }
    }
  }
}